{
  "audiences": [
    "technical",
    "compliance",
    "executive"
  ],
  "catalog_version": "2.0.0",
  "composition_templates": {
    "compliance": {
      "common": {
        "closing": {
          "FAIL_AUTHORIZATION": "Do not treat this as a defective bundle: the evidence is intact and regenerating it would not change the outcome. The remediation stated against the authorization finding above applies, and depending on that finding it falls to the issuer, to the registry operator, or to your own trust material. Document the outcome in the audit trail.",
          "FAIL_MULTI": "Reject the bundle. Require the issuer to address every failing condition listed above and resubmit. Document each rejection reason in the audit trail.",
          "FAIL_SIGNATURE": "Do not treat this as a defective bundle. The bundle's contents verified; what failed is the signature over the registry entry, which is a tampering indicator rather than a formatting fault. Preserve the original bundle and registry entry unaltered, and escalate internally before contacting the counterparty. Obtain re-issued evidence directly from the issuer over a channel you control, as a fresh issuance rather than a correction of this artifact. Document the rejection, the escalation and the preservation step in the audit trail.",
          "FAIL_SINGLE": "Reject the bundle. Require the issuer to address the failing condition and resubmit. Document the rejection in the audit trail.",
          "PASS": "Document the offline verification outcome in the audit trail. Continue with policy-layer evaluation (coverage, freshness, conflict, materiality) as required by the workflow.",
          "REVIEW": "Do not advance the receipt to operational use until the flagged conditions are resolved. Document the review action and outcome in the audit trail before any downstream consumption.",
          "WARN": "Document the offline verification outcome and the recorded warnings in the audit trail. The warnings do not block policy-layer evaluation, but they must be visible to it and to any downstream reviewer."
        }
      },
      "offline_verification": {
        "lead": {
          "FAIL": "The bundle fails offline verification. The receipt cannot be cited as supporting the declared evidence and must not be accepted for listing, settlement, or any downstream operational use.",
          "PASS": "The bundle passes offline verification. The receipt may be cited as a faithful representation of the evidence the issuer attested to, subject to downstream review at the coverage, freshness, conflict, and materiality layers.",
          "REVIEW": "The bundle requires review. At least one operational condition blocks PASS at the offline layer and must be resolved before the receipt can be relied upon for downstream decisions.",
          "WARN": "The bundle passes offline verification with warnings. The receipt may be cited, but at least one non-blocking condition was recorded and must be read and documented before downstream reliance."
        }
      },
      "registry_entry": {
        "lead": {
          "FAIL": "The registry entry records a FAIL verdict. The receipt cannot be cited as supporting the declared evidence and must not be accepted for listing, settlement, or any downstream operational use.",
          "PASS": "The registry entry is a public commitment that the underlying bundle passes offline verification. The receipt may be cited as a faithful representation of the evidence the issuer attested to, subject to downstream review at the coverage, freshness, conflict, and materiality layers.",
          "REVIEW": "The registry entry records a REVIEW verdict. At least one operational condition was not confirmed at issuance time and must be resolved before the receipt can be relied upon for downstream decisions.",
          "WARN": "The registry entry records a WARN verdict. The underlying bundle passed offline verification and at least one non-blocking condition was recorded at issuance time, which must be read and documented before downstream reliance."
        }
      }
    },
    "executive": {
      "common": {
        "closing": {
          "FAIL_AUTHORIZATION": "What must be resolved is the signer's authority, not the record itself.",
          "FAIL_MULTI": "The issuer must produce a corrected version addressing each flagged condition.",
          "FAIL_SIGNATURE": "Preserve this record as received; it should not be replaced by a corrected copy.",
          "FAIL_SINGLE": "The issuer must produce a corrected version.",
          "PASS": "",
          "REVIEW": "The issuer must resolve the flagged conditions before the record is used.",
          "WARN": "The recorded warnings do not prevent the record from being used, but they should be read alongside it."
        }
      },
      "offline_verification": {
        "lead": {
          "FAIL": "The verification record is rejected and cannot be relied upon.",
          "PASS": "The verification record is valid and may be relied upon for the layers it covers.",
          "REVIEW": "The verification record requires review before it can be relied upon.",
          "WARN": "The verification record is valid and may be relied upon, with recorded warnings that should be read alongside it."
        }
      },
      "registry_entry": {
        "lead": {
          "FAIL": "The public registry entry records a rejected verification.",
          "PASS": "The public registry entry confirms a valid verification record.",
          "REVIEW": "The public registry entry records a verification that requires review.",
          "WARN": "The public registry entry confirms a valid verification record that carries recorded warnings."
        }
      }
    },
    "technical": {
      "common": {
        "closing": {
          "FAIL_AUTHORIZATION": "The bundle is internally consistent: manifest, P1, envelope and canonical-input replay all verified. The rejection is at the authorization layer. Act on the specific authorization finding above rather than on the aggregate verdict.",
          "FAIL_MULTI": "Resolve the flagged failures (in canonical order: integrity → coverage → freshness → conflict → policy) and regenerate the bundle before re-verification.",
          "FAIL_SIGNATURE": "The bundle's own contents verified; what failed is the signature over the registry entry. Preserve the artifacts as received before requesting anything from the issuer.",
          "FAIL_SINGLE": "Resolve the flagged failure and regenerate the bundle before re-verification.",
          "PASS": "No further integrity action is required at the offline layer. Coverage, freshness, conflict, and materiality remain to be evaluated by the policy engine where applicable.",
          "REVIEW": "The bundle is not rejected but cannot be confirmed PASS at the offline layer until the flagged checks are resolved or completed.",
          "WARN": "No further integrity action is required at the offline layer. The recorded warnings identify conditions that did not block the verdict and remain visible in the report."
        }
      },
      "offline_verification": {
        "lead": {
          "FAIL": "Offline verification produced a FAIL verdict. At least one deterministic check rejected the bundle.",
          "PASS": "Offline verification produced a PASS verdict. The bundle's manifest, P1 receipt, and envelope hashes recompute deterministically to their declared values.",
          "REVIEW": "Offline verification produced a REVIEW verdict. The bundle is structurally well-formed but at least one check did not complete with confirmation.",
          "WARN": "Offline verification produced a WARN verdict. Every deterministic check completed; at least one recorded a non-blocking condition."
        }
      },
      "registry_entry": {
        "lead": {
          "FAIL": "The registry entry records a FAIL verdict. The receipt records that the underlying bundle did not pass verification at issuance time.",
          "PASS": "The registry entry records a PASS verdict against the issuer's policy at the time of issuance. The receipt is a public commitment that the corresponding bundle passed offline verification.",
          "REVIEW": "The registry entry records a REVIEW verdict. The receipt acknowledges that at least one verification condition was not confirmed at issuance time.",
          "WARN": "The registry entry records a WARN verdict. The receipt is a public commitment that the corresponding bundle passed offline verification with at least one non-blocking condition recorded."
        }
      }
    }
  },
  "entries": {
    "AUTHORIZATION_ISSUER_KEY_EXPIRED": {
      "category": "authorization",
      "code": "AUTHORIZATION_ISSUER_KEY_EXPIRED",
      "compliance": {
        "consequence": "The bundle has not been altered and the issuer is known to the registry. The key's authorization period had ended by the date the verification was evaluated at. Without an attested signing time this does not show that the record was signed after the key expired; it is normally a lapsed credential or an unrenewed registry entry rather than a security event.",
        "headline": "The evidence is intact, but the signing key's authorization had lapsed by the evaluation date.",
        "required_action": "Determine when the record was signed and whether the key was authorized then. If the issuer continued signing after its key expired, other records you hold from the same period carry the same defect and must be re-examined. Otherwise require re-issued evidence under a currently authorized key."
      },
      "executive": {
        "summary": "The record is undamaged, but the signer's credential had lapsed by the date the check was made. This is usually an expired authorisation, not a sign of wrongdoing."
      },
      "severity": "review",
      "technical": {